index,title,content,keyword
0,理智消费,理智消费,Purchasing&Budgeting&Saving
1,理智消费的重要性,理智消费的定义,消费观念&理财规划&消费行为
1.1,消费观念的转变,消费观念的演变,消费心理&消费行为&消费习惯
1.1.1,"消费心理的影响","消费心理是指影响消费者购买行为的心理因素，包括个体的需求、态度、价值观、情感等。","Consumer psychology, Purchase behavior, Individual needs"
1.1.2,"消费行为的变化","消费行为是指消费者在购买商品或服务时所表现出的行为，随着社会经济的发展，消费行为也在不断变化。","Consumer behavior, Economic development, Purchase behavior"
1.1.3,"消费习惯的调整","消费习惯是指消费者在长期的消费过程中形成的一种稳定的购买行为方式，需要通过调整来适应新的消费环境。","Consumer habits, Purchase behavior, Adjustment"
1.2,理财规划的重要性,理财规划的定义,财务管理&投资规划&风险控制
1.2.1,"财务管理的基本原则","财务管理是指对个人或家庭的财务状况进行全面的规划、管理和控制，需要遵循收支平衡、储蓄、投资等基本原则。","Financial management, Planning, Saving"
1.2.2,"投资规划的策略","投资规划是指根据个人的财务状况和风险承受能力，制定合理的投资策略，包括资产配置、风险控制等方面。","Investment planning, Asset allocation, Risk control"
1.2.3,"风险控制的方法","风险控制是指在投资过程中，通过分散投资、选择低风险投资品种等方法，降低投资风险，保障投资收益。","Risk control, Investment, Diversification"
1.3,消费行为的规划,消费行为的目标,消费计划&消费预算&消费记录
1.3.1,"消费计划的制定","消费计划是指根据个人的收入和支出情况，制定合理的消费计划，包括日常消费、大额消费等方面。","Consumption planning, Income and expenditure, Daily consumption"
1.3.2,"消费预算的制定","消费预算是指根据消费计划，制定合理的消费预算，包括生活必需品、娱乐消费等方面。","Consumption budget, Consumption planning, Necessities of life"
1.3.3,"消费记录的管理","消费记录是指对个人的消费情况进行记录和管理，包括收入、支出、储蓄等方面，有助于了解个人的消费状况和调整消费行为。","Consumption record, Income and expenditure, Savings"
2,消费陷阱与应对策略,消费陷阱的类型,消费陷阱&消费误区&消费陷阱应对策略
2.1,消费陷阱的类型,促销陷阱&心理陷阱&信息陷阱
2.1.1,"促销陷阱的特点","促销陷阱是指商家通过各种促销手段，引诱消费者购买商品或服务，需要警惕虚假宣传、价格欺诈等问题。","Promotion trap, False advertising, Price fraud"
2.1.2,"心理陷阱的影响","心理陷阱是指商家通过操纵消费者的心理，引导其进行消费，需要警惕购买冲动、虚荣心等问题。","Psychological trap, Impulse buying, Vanity"
2.1.3,"信息陷阱的危害","信息陷阱是指商家通过虚假信息或隐瞒真相，误导消费者进行消费，需要警惕虚假宣传、欺诈行为等问题。","Information trap, False information, Deception"
2.2,消费误区的纠正,消费误区的原因,消费误区纠正策略
2.2.1,"消费误区的原因","消费误区是指消费者在购买商品或服务时，由于信息不足或认知偏差等原因，做出不理性的决策，需要警惕盲目跟风、过度消费等问题。","Consumption fallacy, Information deficiency, Cognitive bias"
2.2.2,"消费误区的纠正策略","消费误区的纠正需要从提高消费者的信息素养、加强消费者的自我保护意识、规范市场秩序等方面入手，以实现消费者的理性消费。","Consumption fallacy correction, Information literacy, Self-protection awareness"
2.3,消费陷阱应对策略,消费陷阱应对的原则,消费陷阱应对的方法
2.3.1,"消费陷阱应对的原则","消费陷阱应对的原则是保持理性、审慎消费，遵循消费规划、消费预算等基本原则，以避免落入商家的陷阱。","Consumption trap response, Rational consumption, Prudent consumption"
2.3.2,"消费陷阱应对的方法","消费陷阱应对的方法包括提高消费者的信息素养、加强消费者的自我保护意识、选择正规渠道购买商品或服务等方面。","Consumption trap response, Information literacy, Self-protection awareness"
3,理智消费的实践,理智消费的方法,理智消费的案例
3.1,理智消费的方法,消费规划&消费预算&消费记录
3.1.1,"消费规划的制定","消费规划是指根据个人的收入和支出情况，制定合理的消费计划，包括日常消费、大额消费等方面。","Consumption planning, Income and expenditure, Daily consumption"
3.1.2,"消费预算的制定","消费预算是指根据消费计划，制定合理的消费预算，包括生活必需品、娱乐消费等方面。","Consumption budget, Consumption planning, Necessities of life"
3.1.3,"消费记录的管理","消费记录是指对个人的消费情况进行记录和管理，包括收入、支出、储蓄等方面，有助于了解个人的消费状况和调整消费行为。","Consumption record, Income and expenditure, Savings"
3.2,理智消费的案例,购物节&二手交易&租赁服务
3.2.1,"购物节的理智消费","在购物节期间，消费者需要理性消费，避免盲目跟风、过度消费等问题，可以通过比价、筛选商品等方式实现理智消费。","Shopping festival, Rational consumption, Comparison shopping"
3.2.2,"二手交易的理智消费","在二手交易中，消费者需要了解商品的真实情况、价格水平等信息，避免受到欺诈、虚假宣传等问题，以实现理智消费。","Second-hand transaction, Rational consumption, Information literacy"
3.2.3,"租赁服务的理智消费","在租赁服务中，消费者需要了解租赁合同、租金、维修等方面的内容，避免受到不合理的收费、服务质量差等问题，以实现理智消费。","Leasing service, Rational consumption, Contract terms"